{
  "schema_version": 1,
  "catalog_version": "2026-10-30.1",
  "updated_at": "2026-10-30T12:08:01Z",
  "servers": [
    {
      "id": "openai",
      "name": "OpenAI",
      "group": "hosted",
      "provider_family": "openai",
      "status": "active",
      "api_format": "openai_responses",
      "adapter_id": "openai_responses",
      "base_url": "https://api.openai.com/v1",
      "auth": {"mode": "bearer_api_key", "required": true},
      "signup_url": "https://platform.openai.com/",
      "api_key_url": "https://platform.openai.com/api-keys",
      "default_model_id": "gpt-6.1-sol",
      "endpoints": {
        "responses": {"path": "/responses"},
        "models": {"path": "/models"},
        "tts": {"path": "/audio/speech"}
      },
      "fields": {
        "base_url": {"policy": "fixed", "default": "https://api.openai.com/v1"},
        "api_format": {"policy": "fixed", "default": "openai_responses"},
        "auth.mode": {"policy": "fixed", "default": "bearer_api_key"},
        "default_model_id": {"policy": "editable", "default": "gpt-6.1-sol"}
      }
    },
    {
      "id": "anthropic",
      "name": "Anthropic Claude",
      "group": "hosted",
      "provider_family": "anthropic",
      "status": "active",
      "api_format": "anthropic",
      "adapter_id": "anthropic",
      "base_url": "https://api.anthropic.com",
      "auth": {"mode": "api_key_header", "required": true},
      "signup_url": "https://console.anthropic.com/",
      "api_key_url": "https://console.anthropic.com/settings/keys",
      "default_model_id": "claude-sonnet-5",
      "endpoints": {"chat": {"path": "/messages"}, "models": {"path": "/models"}},
      "fields": {
        "base_url": {"policy": "fixed", "default": "https://api.anthropic.com"},
        "api_format": {"policy": "fixed", "default": "anthropic"},
        "auth.mode": {"policy": "fixed", "default": "api_key_header"},
        "default_model_id": {"policy": "editable", "default": "claude-sonnet-5"}
      }
    },
    {
      "id": "google-gemini",
      "name": "Google Gemini API",
      "group": "hosted",
      "provider_family": "google",
      "status": "active",
      "api_format": "google",
      "adapter_id": "google",
      "base_url": "https://generativelanguage.googleapis.com/v1beta",
      "auth": {"mode": "api_key_header", "required": true},
      "signup_url": "https://aistudio.google.com/",
      "api_key_url": "https://aistudio.google.com/app/apikey",
      "default_model_id": "gemini-3.8-flash",
      "endpoints": {"chat": {"path": "/models/{model}:generateContent"}, "models": {"path": "/models"}},
      "fields": {
        "base_url": {"policy": "fixed", "default": "https://generativelanguage.googleapis.com/v1beta"},
        "api_format": {"policy": "fixed", "default": "google"},
        "auth.mode": {"policy": "fixed", "default": "api_key_header"},
        "default_model_id": {"policy": "editable", "default": "gemini-3.8-flash"}
      }
    },
    {
      "id": "xai",
      "name": "xAI",
      "group": "hosted",
      "provider_family": "xai",
      "status": "active",
      "api_format": "openai",
      "adapter_id": "openai",
      "base_url": "https://api.x.ai/v1",
      "auth": {"mode": "bearer_api_key", "required": true},
      "signup_url": "https://console.x.ai/",
      "api_key_url": "https://console.x.ai/",
      "default_model_id": "grok-4.6",
      "endpoints": {"chat": {"path": "/chat/completions"}, "models": {"path": "/models"}},
      "fields": {
        "base_url": {"policy": "fixed", "default": "https://api.x.ai/v1"},
        "api_format": {"policy": "fixed", "default": "openai"},
        "auth.mode": {"policy": "fixed", "default": "bearer_api_key"},
        "default_model_id": {"policy": "editable", "default": "grok-4.6"}
      }
    },
    {
      "id": "deepseek",
      "name": "DeepSeek",
      "group": "hosted",
      "provider_family": "deepseek",
      "status": "active",
      "api_format": "openai",
      "adapter_id": "openai",
      "base_url": "https://api.deepseek.com/v1",
      "auth": {"mode": "bearer_api_key", "required": true},
      "signup_url": "https://platform.deepseek.com/",
      "api_key_url": "https://platform.deepseek.com/api_keys",
      "default_model_id": "deepseek-chat",
      "endpoints": {"chat": {"path": "/chat/completions"}, "models": {"path": "/models"}},
      "fields": {
        "base_url": {"policy": "fixed", "default": "https://api.deepseek.com/v1"},
        "api_format": {"policy": "fixed", "default": "openai"},
        "auth.mode": {"policy": "fixed", "default": "bearer_api_key"},
        "default_model_id": {"policy": "editable", "default": "deepseek-chat"}
      }
    },
    {
      "id": "mistral",
      "name": "Mistral AI",
      "group": "hosted",
      "provider_family": "mistral",
      "status": "active",
      "api_format": "openai",
      "adapter_id": "openai",
      "base_url": "https://api.mistral.ai/v1",
      "auth": {"mode": "bearer_api_key", "required": true},
      "signup_url": "https://console.mistral.ai/",
      "api_key_url": "https://console.mistral.ai/api-keys/",
      "default_model_id": "mistral-small-latest",
      "endpoints": {"chat": {"path": "/chat/completions"}, "models": {"path": "/models"}},
      "fields": {
        "base_url": {"policy": "fixed", "default": "https://api.mistral.ai/v1"},
        "api_format": {"policy": "fixed", "default": "openai"},
        "auth.mode": {"policy": "fixed", "default": "bearer_api_key"},
        "default_model_id": {"policy": "editable", "default": "mistral-small-latest"}
      }
    },
    {
      "id": "groq",
      "name": "Groq",
      "group": "hosted",
      "provider_family": "groq",
      "status": "active",
      "api_format": "openai",
      "adapter_id": "openai",
      "base_url": "https://api.groq.com/openai/v1",
      "auth": {"mode": "bearer_api_key", "required": true},
      "signup_url": "https://console.groq.com/",
      "api_key_url": "https://console.groq.com/keys",
      "default_model_id": "llama-3.3-70b-versatile",
      "endpoints": {"chat": {"path": "/chat/completions"}, "models": {"path": "/models"}},
      "fields": {
        "base_url": {"policy": "fixed", "default": "https://api.groq.com/openai/v1"},
        "api_format": {"policy": "fixed", "default": "openai"},
        "auth.mode": {"policy": "fixed", "default": "bearer_api_key"},
        "default_model_id": {"policy": "editable", "default": "llama-3.3-70b-versatile"}
      }
    },
    {
      "id": "together-ai",
      "name": "Together AI",
      "group": "hosted",
      "provider_family": "together",
      "status": "active",
      "api_format": "openai",
      "adapter_id": "openai",
      "base_url": "https://api.together.xyz/v1",
      "auth": {"mode": "bearer_api_key", "required": true},
      "signup_url": "https://api.together.ai/",
      "api_key_url": "https://api.together.ai/settings/api-keys",
      "endpoints": {"chat": {"path": "/chat/completions"}, "models": {"path": "/models"}},
      "fields": {
        "base_url": {"policy": "fixed", "default": "https://api.together.xyz/v1"},
        "api_format": {"policy": "fixed", "default": "openai"},
        "auth.mode": {"policy": "fixed", "default": "bearer_api_key"}
      }
    },
    {
      "id": "fireworks-ai",
      "name": "Fireworks AI",
      "group": "hosted",
      "provider_family": "fireworks",
      "status": "active",
      "api_format": "openai",
      "adapter_id": "openai",
      "base_url": "https://api.fireworks.ai/inference/v1",
      "auth": {"mode": "bearer_api_key", "required": true},
      "signup_url": "https://fireworks.ai/",
      "api_key_url": "https://fireworks.ai/account/api-keys",
      "endpoints": {"chat": {"path": "/chat/completions"}, "models": {"path": "/models"}},
      "fields": {
        "base_url": {"policy": "fixed", "default": "https://api.fireworks.ai/inference/v1"},
        "api_format": {"policy": "fixed", "default": "openai"},
        "auth.mode": {"policy": "fixed", "default": "bearer_api_key"}
      }
    },
    {
      "id": "perplexity",
      "name": "Perplexity API",
      "group": "hosted",
      "provider_family": "perplexity",
      "status": "active",
      "api_format": "openai",
      "adapter_id": "openai",
      "base_url": "https://api.perplexity.ai",
      "auth": {"mode": "bearer_api_key", "required": true},
      "signup_url": "https://www.perplexity.ai/",
      "api_key_url": "https://www.perplexity.ai/settings/api",
      "default_model_id": "sonar",
      "endpoints": {"chat": {"path": "/chat/completions"}},
      "fields": {
        "base_url": {"policy": "fixed", "default": "https://api.perplexity.ai"},
        "api_format": {"policy": "fixed", "default": "openai"},
        "auth.mode": {"policy": "fixed", "default": "bearer_api_key"},
        "default_model_id": {"policy": "editable", "default": "sonar"}
      }
    },
    {
      "id": "cohere",
      "name": "Cohere",
      "group": "hosted",
      "provider_family": "cohere",
      "status": "active",
      "api_format": "openai",
      "adapter_id": "openai",
      "base_url": "https://api.cohere.ai/compatibility/v1",
      "auth": {"mode": "bearer_api_key", "required": true},
      "signup_url": "https://dashboard.cohere.com/",
      "api_key_url": "https://dashboard.cohere.com/api-keys",
      "endpoints": {"chat": {"path": "/chat/completions"}},
      "fields": {
        "base_url": {"policy": "fixed", "default": "https://api.cohere.ai/compatibility/v1"},
        "api_format": {"policy": "fixed", "default": "openai"},
        "auth.mode": {"policy": "fixed", "default": "bearer_api_key"}
      }
    },
    {
      "id": "zai-global",
      "name": "Z.ai — API geral",
      "group": "hosted",
      "provider_family": "zai",
      "status": "active",
      "api_format": "openai",
      "adapter_id": "openai",
      "base_url": "https://api.z.ai/api/paas/v4",
      "auth": {"mode": "bearer_api_key", "required": true},
      "signup_url": "https://z.ai/",